"Metaphor","SubMetaphor","Title","aliases","acronyms","NOTES"
"Social Engineering",NA,"Social Engineering Optimization (SEO); A New Single-Solution Meta-heuristic Inspired by Social Engineering",NA,NA,NA
"Social Spiders",NA,"A swarm optimization algorithm inspired in the behavior of the social-spider","social spider, social-spider","SSO",""
"Sooty Tern",NA,"{STOA}: A bio-inspired based optimization algorithm for industrial engineering problems",NA,NA,NA
"Sperm",NA,"Sperm motility algorithm: a novel metaheuristic approach for global optimisation","sperm motility","SMA",""
"Sports Championships",NA,"League Championship Algorithm: A New Algorithm for Numerical Function Optimization","league championship algorithm","LCA",""
"Squirrels","Flying Squirrels","A novel nature-inspired algorithm for optimization: Squirrel search algorithm","squirrel search","","SSA = salt swarm"
"Swallows",NA,"Swallow swarm optimization algorithm: a new method to optimization","swallow swarm","","SSO = social spider optim"
"Symbiotic Organisms",NA,"Symbiotic Organisms Search: A new metaheuristic optimization algorithm","symbiotic organisms","","SOS = Save our Souls"
"Sonar",NA,"A New Metaheuristic Method for Optimization: Sonar Inspired Optimization",NA,NA,NA
"States of Matter",NA,"A Multimodal Optimization Algorithm Inspired by the States of Matter",NA,NA,NA
"Teachers",NA,"Teaching{\textendash}learning-based optimization: A novel method for constrained mechanical design optimization problems","teaching-learning, teaching learning","TLBO",""
"Termites",NA,"Termite colony optimization: A novel approach for optimizing continuous problems","termite colony","TCO",""
"Troops of Soldiers",NA,"A Simulative Bionic Intelligent Optimization Algorithm: Artificial Searching Swarm Algorithm and Its Performance Analysis","artificial searching swarm","ASSA",""
"Tug of War",NA,"A novel meta-heuristic algorithm: tug of war optimization","tug of war, tug-of-war","","TWO = number two"
"Turnicates",NA,"Tunicate Swarm Algorithm: A new bio-inspired based metaheuristic paradigm for global optimization",NA,NA,NA
"Vaccination",NA,"Research on Permutation Flow-shop Scheduling Problem based on Improved Genetic Immune Algorithm with vaccinated offspring","vaccinated offspring","VacGA",""
"Vibrating Particles",NA,"Vibrating particles system algorithm for truss optimization with multiple natural frequency constraints","vibrating particles system algorithm","VPS",""
"Viruses","Virus Replication","Viral systems: A new bio-inspired optimisation approach","viral systems","","VS"
"Viruses","Virus Colonies","A novel nature-inspired algorithm for optimization: Virus colony search","virus colony search, virus colony algo, virus colony optim","VCS",""
"Viruses","Virulence","Virulence Optimization Algorithm","virulence optim, virulence algo","VOA",""
"Virus","Swine Flu","Swine Influenza Models Based Optimization ({SIMBO})",NA,NA,NA
"Virus","Attacking","A novel metaheuristic for continuous optimization problems: Virus optimization algorithm",NA,NA,NA
"Volleyball Leagues",NA,"Volleyball Premier League Algorithm","volleyball premier league algo","VPL",""
"Vortices",NA,"A new metaheuristic for numerical function optimization: Vortex Search algorithm","vortex search","","VS"
"Vultures",NA,"Egyptian Vulture Optimization Algorithm {\textendash} A New Nature Inspired Meta-heuristics for Knapsack Problem","egyptian vulture","EVOA",""
"Vehicles",NA,"Passing vehicle search ({PVS}): A novel metaheuristic algorithm",NA,NA,NA
"Wasps",NA,"Wasp swarm optimization of logistic systems","wasp swarm","WSO",""
"Water","Rain","Rain-fall optimization algorithm: A population based algorithm for solving constrained optimization problems",NA,NA,NA
"Water","Hydrological Cycle","Hydrological Cycle Algorithm for Continuous Optimization Problems",NA,NA,NA
"Water","Intelligent Water Drops","The intelligent water drops algorithm: a nature-inspired swarm-based optimization algorithm","intelligent water drops","IWD",""
"Water","Rain Drops","Optimal approximation of stable linear systems with a novel and efficient optimization algorithm","artificial raindrop","ARA",""
"Water","Water Cycle","Water cycle algorithm {\textendash} A novel metaheuristic optimization method for solving constrained engineering optimization problems","water cycle algo","WCA",""
"Water","Water Evaporation","Water Evaporation Optimization: A novel physically inspired optimization algorithm","water evaporation optim","WEO",""
"Water","Water Flow","A water-flow algorithm for flexible flow shop scheduling with~intermediate buffers","water-flow algo, water flow algo","WFA",""
"Water","Water Wave","Water wave optimization: A new nature-inspired metaheuristic","water wave optim","WWO",""
"Whales","Regular Whales","The Whale Optimization Algorithm","whale optim, whale algo","WOA",""
"Whales","Binary Whales","Binary whale optimization algorithm: a new metaheuristic approach for profit-based unit commitment problems in competitive electricity markets",NA,NA,NA
"Whales","Sperm Whales","Sperm whale algorithm: An effective metaheuristic algorithm for production optimization problems","sperm whale algo","SWA",""
"Whales","Killer Whales","Killer Whale Algorithm: An Algorithm Inspired by the Life of Killer Whale","killer whale algo","KWA",""
"Whales","Orcas","A New Swarm Algorithm Based on Orcas Intelligence for Solving Maze Problems",NA,NA,NA
"Whirlpools",NA,"A novel and effective optimization algorithm for global optimization and its engineering applications: Turbulent Flow of Water-based Optimization ({TFWO})",NA,NA,NA
"Wind",NA,"Wind Driven Optimization ({WDO}): A novel nature-inspired optimization algorithm and its application to electromagnetics","wind driven optim","WDO",""
"Wolves","Wolves","Wolf search algorithm with ephemeral memory","wolf search, wolf algo","WSA",""
"Wolves","Grey Wolves","Grey Wolf Optimizer","grey wolf optim, grey wolf algo","GWO",""
"Worms",NA,"Worm optimization: a novel optimization algorithm inspired by C. Elegans","worm optim, worm algo","WO",""
"Yin-Yang Pairs",NA,"Yin-Yang-pair Optimization: A novel lightweight optimization algorithm","yin-yang, yin yang","YYPO",""
"Yellow Saddle Goldfish",NA,"A novel bio-inspired optimization model based on Yellow Saddle Goatfish behavior",NA,NA,NA
"Zombies",NA,"Zombie Survival Optimization: A swarm intelligence algorithm inspired by zombie foraging","zombie foraging, zombie survival, zombie algo","ZSO",""
